<?xml version="1.0" encoding="UTF-8"?>
<!DOCTYPE whatsapp SYSTEM "whatsapp.dtd">
<whatsapp>
  <discussions>
    <contacts>
      <contact id="1">
        <nom>Diagne</nom>
        <prenom>Yacine fall</prenom>
        <numero_telephone>77123456789</numero_telephone>
        <photo_profile>images/contact_1_1752600097.jpg</photo_profile>
        <status>Hors ligne</status>
        <messages>
          <message id="1" type="texte" expediteur="1" destinataire="2">
            <contenu>Bonjour Yacine !</contenu>
            <message_info heure="2025-07-10T10:15:00" statut="double check"/>
          </message>
          <message id="2" type="texte" expediteur="2" destinataire="1">
            <contenu>Coucou Amina !</contenu>
            <cite ref="1"/>
            <message_info heure="2025-07-10T10:18:10" statut="lu"/>
          </message>
          <message id="10" type="texte" expediteur="1" destinataire="2">
            <contenu>comment tu vas ?</contenu>
            <message_info heure="2025-07-10T21:45:47" statut="double check"/>
          </message>
        </messages>
      </contact>
      
      <contact id="2">
        <nom>Sylla</nom>
        <prenom>Dié</prenom>
        <numero_telephone>987654321</numero_telephone>
        <photo_profile>images/image.png</photo_profile>
        <status>Hors ligne</status>
        <messages>
          <message id="3" type="texte" expediteur="1" destinataire="2">
            <contenu>Coucou Dié !</contenu>
            <message_info heure="2025-07-10T09:18:00" statut="envoye"/>
          </message>
          <message id="4" type="texte" expediteur="2" destinataire="1">
            <contenu>Salut Amina, comment tu vas</contenu>
            <cite ref="3"/>
            <message_info heure="2025-07-10T09:18:30" statut="double check"/>
          </message>
        </messages>
      </contact>
      
      <contact id="3">
        <nom>Ba</nom>
        <prenom>Marie</prenom>
        <numero_telephone>4225485</numero_telephone>
        <photo_profile>images/image.png</photo_profile>
        <status>En ligne</status>
        <messages>
          <message id="11" type="texte" expediteur="1" destinataire="3">
            <contenu>coucou</contenu>
            <message_info heure="2025-07-10T22:29:48" statut="double check"/>
          </message>
        </messages>
      </contact>
      
      <contact id="4">
        <nom>Cruz</nom>
        <prenom>Zahra</prenom>
        <numero_telephone>771234567</numero_telephone>
        <photo_profile>images/contact_4_1752600164.jpg</photo_profile>
        <status>Hors ligne</status>
        <messages/>
      </contact>
      
      <contact id="5">
        <nom>Sané</nom>
        <prenom>Alioune</prenom>
        <numero_telephone>781234567</numero_telephone>
        <photo_profile>images/image.png</photo_profile>
        <status>En ligne</status>
        <messages/>
      </contact>
      
      <contact id="6">
        <nom>Gueye</nom>
        <prenom>Assane</prenom>
        <numero_telephone>761234567</numero_telephone>
        <photo_profile>images/image.png</photo_profile>
        <status>Hors ligne</status>
        <messages/>
      </contact>
    </contacts>
    
    <groupes>
      <groupe id="1">
        <nom_groupe>Projet XML</nom_groupe>
        <photo_groupe>images/groupe.png</photo_groupe>
        <membres>
          <contact id="1">
            <nom>Sow</nom>
            <prenom>Tidiane</prenom>
            <numero_telephone>123456789</numero_telephone>
            <photo_profile>tidiane.jpg</photo_profile>
            <status>En ligne</status>
          </contact>
          <contact id="2">
            <nom>Sané</nom>
            <prenom>Alioune</prenom>
            <numero_telephone>987654321</numero_telephone>
            <photo_profile>alioune.jpg</photo_profile>
            <status>Hors ligne</status>
          </contact>
        </membres>
        <admin ref="1"/>
        <messages>
          <message id="5" type="texte" expediteur="1">
            <contenu>Salut tout le monde!</contenu>
            <message_info heure="2025-07-27T09:16:00" statut="double check"/>
          </message>
          <message id="6" type="texte" expediteur="2">
            <contenu>Bonjour alioune!</contenu>
            <message_info heure="2025-07-27T09:14:00" statut="double check"/>
          </message>
          <message id="7" type="texte" expediteur="1">
            <contenu>salut</contenu>
            <message_info heure="2025-07-12T23:17:49" statut="double check"/>
          </message>
          <message id="8" type="texte" expediteur="2">
            <contenu>bonjour tout le monde</contenu>
            <message_info heure="2025-07-14T16:51:00" statut="double check"/>
          </message>
          <message id="9" type="texte" expediteur="1">
            <contenu>oui</contenu>
            <message_info heure="2025-07-10T21:45:28" statut="double check"/>
          </message>
        </messages>
      </groupe>
    </groupes>
  </discussions>
</whatsapp>
